<?xml version="1.0" encoding="UTF-8"?>
<!ELEMENT dataset (table+)>
<!ELEMENT table (column*, row*)>
<!ATTLIST table
    name CDATA #REQUIRED
>
<!ELEMENT column (#PCDATA)>
<!ELEMENT row (value | null | none)*>
<!ELEMENT value (#PCDATA)>
<!ELEMENT none (#PCDATA)>
<!ELEMENT null EMPTY>